{
  "_id": "sha256:ad520f17905f9ea24c9cb3558b2366bb489ca128eacaef05f9692e571e104416",
  "schema_version": 1,
  "scene_set_version": "sha256:37c9ff2cbfb0890ef9c3f4963b1dbcb109d2f8f65a50db3a043cee8c76cbe7e1",
  "asset_version": "sha256:9f86d081884c7d659a2feaa0c55ad015a3bf4f1b2b0b822cd15d6c15b0f00a08",
  "segmentation_fingerprint": "3b9e1f6a2c40",
  "pins": [
    "transcript:e41a9c27b0d5"
  ],
  "chunk_count": 1,
  "created_at": "2026-10-28T12:00:00Z",
  "lineage": {
    "step": "chunking",
    "fingerprint": "c7a1e2f3b4d5",
    "inputs": [
      "scene-record:sha256:63f3b42173c70a228702f3c7438d5a93db71290e34650639470adf4622f3c908"
    ],
    "version": "sha256:ad520f17905f9ea24c9cb3558b2366bb489ca128eacaef05f9692e571e104416",
    "image": null
  }
}
